{"client":"web-monitor","client_url":"https://monitor.internal/dashboards/db","dedup_key":"db-latency-p99-prod-20261005","event_action":"trigger","payload":{"class":"latency","component":"postgres-primary","custom_details":{"cluster":"prod-eu","env":"prod","p99_ms":2310,"region":"eu-west"},"group":"databases","images":[{"alt":"p99 latency graph","href":"https://monitor.internal/alerts/88412","src":"https://monitor.internal/alerts/88412/graph.png"}],"links":[{"href":"https://monitor.internal/runbooks/db-latency","text":"DB latency runbook"}],"region":"eu-west","severity":"critical","source":"db-primary-1.internal","summary":"DB latency p99 > 2s for 5 minutes","timestamp":"2026-10-05T14:39:50+00:00"},"routing_key":"rk-0123456789abcdef0123456789abcdef"}